{
    "$schema": "http://json-schema.org/schema",
    "title": "Cubes Model",
    "type": "object",

    "properties": {
        "name": {"type": "string"},
        "label": {"type": "string"},
        "description": {"type": "string"},
        "info": {"type": "object"},

        "provider": {"type": "string"},

        "browser_options": {"type": "object"},

        "cubes": {"type": "array"},
        "dimensions": {"type": "array"},

        "schema": {"type": "string"},
        "store": {"type": "string"},
        "mappings": {"type": "object"},
        "joins": {"type": "array"}
    },
    "additionalProperties": false
}
